Day-7 : sql -operators
-----------------------

1.What is an operator?

A: Operator is asymbol it perform specific task

*) arthimetic operators:
----------------------------
	(+,-,*,/,%)

*) comparison:
-----------------
	(>,<,==,>=,<=)

*) logicial-operators:
--------------------------
	(&,||,)
Questions:

1. calculate the value with adding 12% tax to the each column?

A: 
mysql> select name,price, price+(price*0.12)as price_with_tax from products;
+--------------+--------+----------------+
| name         | price  | price_with_tax |
+--------------+--------+----------------+
| Pen          |  10.00 |        11.2000 |
| Notebook     |  25.00 |        28.0000 |
| Pencil       |   5.00 |         5.6000 |
| Eraser       |   3.00 |         3.3600 |
| Marker       |  15.00 |        16.8000 |
| Scale        |  20.00 |        22.4000 |
| Sharpener    |   8.00 |         8.9600 |
| Geometry Box | 120.00 |       134.4000 |
| Sketch Pen   |  60.00 |        67.2000 |
| Crayons      |  90.00 |       100.8000 |
+--------------+--------+----------------+
10 rows in set (0.00 sec)

2. Calculate the discounted price by subtracting from price?

A:mysql> select name,price, price - (5)as discounted_prices from products;
+--------------+--------+-------------------+
| name         | price  | discounted_prices |
+--------------+--------+-------------------+
| Pen          |  10.00 |              5.00 |
| Notebook     |  25.00 |             20.00 |
| Pencil       |   5.00 |              0.00 |
| Eraser       |   3.00 |             -2.00 |
| Marker       |  15.00 |             10.00 |
| Scale        |  20.00 |             15.00 |
| Sharpener    |   8.00 |              3.00 |
| Geometry Box | 120.00 |            115.00 |
| Sketch Pen   |  60.00 |             55.00 |
| Crayons      |  90.00 |             85.00 |
+--------------+--------+-------------------+
10 rows in set (0.00 sec)

3. total inventory value for products?

A:mysql> select name, price, qty, price*qty as inventory_price from products;
 +--------------+--------+------+-----------------+
| name         | price  | qty  | inventory_price |
+--------------+--------+------+-----------------+
| Pen          |  10.00 |  100 |         1000.00 |
| Notebook     |  25.00 |   50 |         1250.00 |
| Pencil       |   5.00 |  200 |         1000.00 |
| Eraser       |   3.00 |  300 |          900.00 |
| Marker       |  15.00 |   80 |         1200.00 |
| Scale        |  20.00 |  150 |         3000.00 |
| Sharpener    |   8.00 |  120 |          960.00 |
| Geometry Box | 120.00 |   40 |         4800.00 |
| Sketch Pen   |  60.00 |   75 |         4500.00 |
| Crayons      |  90.00 |   55 |         4950.00 |
+--------------+--------+------+-----------------+
10 rows in set (0.00 sec)

4. calculate the price for 10 units for all in the products table?

A:mysql> select name, price, price*10 as price_for_10_units from products;
+--------------+--------+--------------------+
| name         | price  | price_for_10_units |
+--------------+--------+--------------------+
| Pen          |  10.00 |             100.00 |
| Notebook     |  25.00 |             250.00 |
| Pencil       |   5.00 |              50.00 |
| Eraser       |   3.00 |              30.00 |
| Marker       |  15.00 |             150.00 |
| Scale        |  20.00 |             200.00 |
| Sharpener    |   8.00 |              80.00 |
| Geometry Box | 120.00 |            1200.00 |
| Sketch Pen   |  60.00 |             600.00 |
| Crayons      |  90.00 |             900.00 |
+--------------+--------+--------------------+
10 rows in set (0.00 sec) 

5. 


6. add 2 units to the products?

A: mysql> update products set qty = qty + 2;
Query OK, 10 rows affected (0.01 sec)
Rows matched: 10  Changed: 10  Warnings: 0

mysql> select * from products;
+------+--------------+--------+------+
| id   | name         | price  | qty  |
+------+--------------+--------+------+
|    1 | Pen          |  10.00 |  102 |
|    2 | Notebook     |  25.00 |   52 |
|    3 | Pencil       |   5.00 |  202 |
|    4 | Eraser       |   3.00 |  302 |
|    5 | Marker       |  15.00 |   82 |
|    6 | Scale        |  20.00 |  152 |
|    7 | Sharpener    |   8.00 |  122 |
|    8 | Geometry Box | 120.00 |   42 |
|    9 | Sketch Pen   |  60.00 |   77 |
|   10 | Crayons      |  90.00 |   57 |
+------+--------------+--------+------+
10 rows in set (0.00 sec)

7. subtracgt 5 from the prices of each products?

A:mysql> update products set price = price - (5);
Query OK, 10 rows affected (0.01 sec)
Rows matched: 10  Changed: 10  Warnings: 0

mysql> select * from products;
+------+--------------+--------+------+
| id   | name         | price  | qty  |
+------+--------------+--------+------+
|    1 | Pen          |   5.00 |  102 |
|    2 | Notebook     |  20.00 |   52 |
|    3 | Pencil       |   0.00 |  202 |
|    4 | Eraser       |  -2.00 |  302 |
|    5 | Marker       |  10.00 |   82 |
|    6 | Scale        |  15.00 |  152 |
|    7 | Sharpener    |   3.00 |  122 |
|    8 | Geometry Box | 115.00 |   42 |
|    9 | Sketch Pen   |  55.00 |   77 |
|   10 | Crayons      |  85.00 |   57 |
+------+--------------+--------+------+
10 rows in set (0.00 sec)

8. double the qty of erasers?

A: mysql> update products set qty = qty*2 where id = 4;
Query OK, 1 row affected (0.01 sec)
Rows matched: 1  Changed: 1  Warnings: 0

mysql> select * from products;
+------+--------------+--------+------+
| id   | name         | price  | qty  |
+------+--------------+--------+------+
|    1 | Pen          |   5.00 |  102 |
|    2 | Notebook     |  20.00 |   52 |
|    3 | Pencil       |   0.00 |  202 |
|    4 | Eraser       |  -2.00 |  604 |
|    5 | Marker       |  10.00 |   82 |
|    6 | Scale        |  15.00 |  152 |
|    7 | Sharpener    |   3.00 |  122 |
|    8 | Geometry Box | 115.00 |   42 |
|    9 | Sketch Pen   |  55.00 |   77 |
|   10 | Crayons      |  85.00 |   57 |
+------+--------------+--------+------+
9. half the qty of markers?

A: mysql> update products set qty = qty/2 where id = 5;
Query OK, 1 row affected (0.01 sec)
Rows matched: 1  Changed: 1  Warnings: 0

mysql> select * from products;
+------+--------------+--------+------+
| id   | name         | price  | qty  |
+------+--------------+--------+------+
|    1 | Pen          |   5.00 |  102 |
|    2 | Notebook     |  20.00 |   52 |
|    3 | Pencil       |   0.00 |  202 |
|    4 | Eraser       |  -2.00 |  604 |
|    5 | Marker       |  10.00 |   41 |
|    6 | Scale        |  15.00 |  152 |
|    7 | Sharpener    |   3.00 |  122 |
|    8 | Geometry Box | 115.00 |   42 |
|    9 | Sketch Pen   |  55.00 |   77 |
|   10 | Crayons      |  85.00 |   57 |
+------+--------------+--------+------+
10 rows in set (0.00 sec)

10. delete products where qty is <100

A: mysql> delete from products where qty<100;
Query OK, 5 rows affected (0.09 sec)

mysql> select * from products;
+------+-----------+-------+------+
| id   | name      | price | qty  |
+------+-----------+-------+------+
|    1 | Pen       |  5.00 |  102 |
|    3 | Pencil    |  0.00 |  202 |
|    4 | Eraser    | -2.00 |  604 |
|    6 | Scale     | 15.00 |  152 |
|    7 | Sharpener |  3.00 |  122 |
+------+-----------+-------+------+
5 rows in set (0.00 sec)

11. students who scored more than 80?

A: 
mysql> select * from studentscores where marks>80;
+------+-------+---------+-------+
| id   | name  | subject | marks |
+------+-------+---------+-------+
|    1 | Alice | Math    |    95 |
|    4 | Diana | Math    |    88 |
|    6 | Frank | Math    |    95 |
|    8 | Henry | Science |    82 |
|    9 | Ivy   | English |    91 |
|   13 | Mia   | English |   100 |
+------+-------+---------+-------+
6 rows in set (0.00 sec)

12. students who scored 60 or more than 60?

A:mysql> select * from studentscores where marks>=60;
+------+--------+---------+-------+
| id   | name   | subject | marks |
+------+--------+---------+-------+
|    1 | Alice  | Math    |    95 |
|    2 | Bob    | Math    |    76 |
|    4 | Diana  | Math    |    88 |
|    6 | Frank  | Math    |    95 |
|    7 | Grace  | Science |    67 |
|    8 | Henry  | Science |    82 |
|    9 | Ivy    | English |    91 |
|   11 | Kevin  | Math    |    73 |
|   13 | Mia    | English |   100 |
|   14 | Noah   | Math    |    64 |
|   15 | Olivia | Science |    79 |
+------+--------+---------+-------+
11 rows in set (0.00 sec)

13. students who scored less than 50?

A: mysql> select * from studentscores where marks<50;
+------+------+---------+-------+
| id   | name | subject | marks |
+------+------+---------+-------+
|    5 | Eve  | Math    |    40 |
|   12 | Lily | Science |    48 |
+------+------+---------+-------+
2 rows in set (0.00 sec)

14. students who scored 95

A: mysql> select * from studentscores where marks = 95;
+------+-------+---------+-------+
| id   | name  | subject | marks |
+------+-------+---------+-------+
|    1 | Alice | Math    |    95 |
|    6 | Frank | Math    |    95 |
+------+-------+---------+-------+
2 rows in set (0.00 sec)

15. students who did not scored 95

A: mysql> select * from studentscores where marks != 95;
+------+---------+---------+-------+
| id   | name    | subject | marks |
+------+---------+---------+-------+
|    2 | Bob     | Math    |    76 |
|    3 | Charlie | Math    |    59 |
|    4 | Diana   | Math    |    88 |
|    5 | Eve     | Math    |    40 |
|    7 | Grace   | Science |    67 |
|    8 | Henry   | Science |    82 |
|    9 | Ivy     | English |    91 |
|   10 | Jack    | English |    55 |
|   11 | Kevin   | Math    |    73 |
|   12 | Lily    | Science |    48 |
|   13 | Mia     | English |   100 |
|   14 | Noah    | Math    |    64 |
|   15 | Olivia  | Science |    79 |
+------+---------+---------+-------+
13 rows in set (0.00 sec)

16. who scored less than or 60 ?

A: mysql> select * from studentscores where marks <= 60;
+------+---------+---------+-------+
| id   | name    | subject | marks |
+------+---------+---------+-------+
|    3 | Charlie | Math    |    59 |
|    5 | Eve     | Math    |    40 |
|   10 | Jack    | English |    55 |
|   12 | Lily    | Science |    48 |
+------+---------+---------+-------+
4 rows in set (0.00 sec)

notes link upto day 6 : https://docs.google.com/document/d/1aCfg72Jj0OshvGY7SB3Y8HbXrlAFWeJhbIa3KUsuAI8/edit?tab=t.0#heading=h.cumd2pwx3uwps