Day_8 of sql
-------------
1. Update salaries with 2000 for active it employees who earn less than 60000?
mysql> update employees set salary = salary+2000 where department = 'IT' and isactive=1;
Query OK, 4 rows affected (0.02 sec)
Rows matched: 4  Changed: 4  Warnings: 0

mysql> select * from employees;
+------+---------------+------------+--------+----------+
| id   | name          | department | salary | isactive |
+------+---------------+------------+--------+----------+
|    1 | Rahul Sharma  | IT         |  52000 |        1 |
|    2 | Priya Reddy   | HR         |  30000 |        1 |
|    3 | Amit Kumar    | Finance    |  45000 |        0 |
|    4 | Sneha Patel   | IT         |  37000 |        1 |
|    5 | Vikram Singh  | Finance    |  28000 |        1 |
|    6 | Anjali Mehta  | HR         |  32000 |        0 |
|    7 | Kiran Rao     | IT         |  62000 |        1 |
|    8 | Pooja Verma   | Marketing  |  27000 |        1 |
|    9 | Ramesh Naidu  | Sales      |  38000 |        1 |
|   10 | Deepika Joshi | Finance    |  52000 |        1 |
|   11 | Suresh Babu   | Marketing  |  29000 |        0 |
|   12 | Neha Kapoor   | HR         |  41000 |        1 |
|   13 | Arjun Reddy   | IT         |  55000 |        0 |
|   14 | Lakshmi Devi  | Sales      |  33000 |        1 |
|   15 | Nikhil Jain   | IT         |  49000 |        1 |
+------+---------------+------------+--------+----------+
15 rows in set (0.00 sec)

2. Make Finance or inactive employees salary 10% less
A:
mysql> update employees set salary = salary - (salary*0.10) where department = 'Finance' and isactive = 0;
Query OK, 1 row affected (0.01 sec)
Rows matched: 1  Changed: 1  Warnings: 0

mysql> select * from employees;
+------+---------------+------------+--------+----------+
| id   | name          | department | salary | isactive |
+------+---------------+------------+--------+----------+
|    1 | Rahul Sharma  | IT         |  52000 |        1 |
|    2 | Priya Reddy   | HR         |  30000 |        1 |
|    3 | Amit Kumar    | Finance    |  40500 |        0 |
|    4 | Sneha Patel   | IT         |  37000 |        1 |
|    5 | Vikram Singh  | Finance    |  28000 |        1 |
|    6 | Anjali Mehta  | HR         |  32000 |        0 |
|    7 | Kiran Rao     | IT         |  62000 |        1 |
|    8 | Pooja Verma   | Marketing  |  27000 |        1 |
|    9 | Ramesh Naidu  | Sales      |  38000 |        1 |
|   10 | Deepika Joshi | Finance    |  52000 |        1 |
|   11 | Suresh Babu   | Marketing  |  29000 |        0 |
|   12 | Neha Kapoor   | HR         |  41000 |        1 |
|   13 | Arjun Reddy   | IT         |  55000 |        0 |
|   14 | Lakshmi Devi  | Sales      |  33000 |        1 |
|   15 | Nikhil Jain   | IT         |  49000 |        1 |
+------+---------------+------------+--------+----------+
15 rows in set (0.00 sec)

mysql> update employees set isactive = 0 where not department = 'it';
Query OK, 7 rows affected (0.01 sec)
Rows matched: 10  Changed: 7  Warnings: 0

3. Deactivate all employees who are not 'it' department?
A:mysql> update employees set isactive = 0 where not department = 'it';
Query OK, 7 rows affected (0.01 sec)
Rows matched: 10  Changed: 7  Warnings: 0

mysql> select * from employees;
+------+---------------+------------+--------+----------+
| id   | name          | department | salary | isactive |
+------+---------------+------------+--------+----------+
|    1 | Rahul Sharma  | IT         |  52000 |        1 |
|    2 | Priya Reddy   | HR         |  30000 |        0 |
|    3 | Amit Kumar    | Finance    |  40500 |        0 |
|    4 | Sneha Patel   | IT         |  37000 |        1 |
|    5 | Vikram Singh  | Finance    |  28000 |        0 |
|    6 | Anjali Mehta  | HR         |  32000 |        0 |
|    7 | Kiran Rao     | IT         |  62000 |        1 |
|    8 | Pooja Verma   | Marketing  |  27000 |        0 |
|    9 | Ramesh Naidu  | Sales      |  38000 |        0 |
|   10 | Deepika Joshi | Finance    |  52000 |        0 |
|   11 | Suresh Babu   | Marketing  |  29000 |        0 |
|   12 | Neha Kapoor   | HR         |  41000 |        0 |
|   13 | Arjun Reddy   | IT         |  55000 |        0 |
|   14 | Lakshmi Devi  | Sales      |  33000 |        0 |
|   15 | Nikhil Jain   | IT         |  49000 |        1 |
+------+---------------+------------+--------+----------+
15 rows in set (0.00 sec)


Delete
---------
1. Delete employees from hr department who are also inactive?
A:
mysql> delete from employees where isactive = 0 and department = 'hr';
Query OK, 3 rows affected (0.01 sec)

mysql> select * from employees;
+------+---------------+------------+--------+----------+
| id   | name          | department | salary | isactive |
+------+---------------+------------+--------+----------+
|    1 | Rahul Sharma  | IT         |  52000 |        1 |
|    3 | Amit Kumar    | Finance    |  40500 |        0 |
|    4 | Sneha Patel   | IT         |  37000 |        1 |
|    5 | Vikram Singh  | Finance    |  28000 |        0 |
|    7 | Kiran Rao     | IT         |  62000 |        1 |
|    8 | Pooja Verma   | Marketing  |  27000 |        0 |
|    9 | Ramesh Naidu  | Sales      |  38000 |        0 |
|   10 | Deepika Joshi | Finance    |  52000 |        0 |
|   11 | Suresh Babu   | Marketing  |  29000 |        0 |
|   13 | Arjun Reddy   | IT         |  55000 |        0 |
|   14 | Lakshmi Devi  | Sales      |  33000 |        0 |
|   15 | Nikhil Jain   | IT         |  49000 |        1 |
+------+---------------+------------+--------+----------+
12 rows in set (0.00 sec)

2. Delete employees who are either from finance or salary is < 35000?

A:
mysql> delete from employees where salary<35000 or department = 'Finance';
Query OK, 6 rows affected (0.01 sec)

mysql> select * from employees;
+------+--------------+------------+--------+----------+
| id   | name         | department | salary | isactive |
+------+--------------+------------+--------+----------+
|    1 | Rahul Sharma | IT         |  52000 |        1 |
|    4 | Sneha Patel  | IT         |  37000 |        1 |
|    7 | Kiran Rao    | IT         |  62000 |        1 |
|    9 | Ramesh Naidu | Sales      |  38000 |        0 |
|   13 | Arjun Reddy  | IT         |  55000 |        0 |
|   15 | Nikhil Jain  | IT         |  49000 |        1 |
+------+--------------+------------+--------+----------+
6 rows in set (0.00 sec)

3. Delete all employees not in the IT department?

A:
mysql> delete from employees where not department = 'it';
Query OK, 1 row affected (0.01 sec)

mysql> select * from employees;
+------+--------------+------------+--------+----------+
| id   | name         | department | salary | isactive |
+------+--------------+------------+--------+----------+
|    1 | Rahul Sharma | IT         |  52000 |        1 |
|    4 | Sneha Patel  | IT         |  37000 |        1 |
|    7 | Kiran Rao    | IT         |  62000 |        1 |
|   13 | Arjun Reddy  | IT         |  55000 |        0 |
|   15 | Nikhil Jain  | IT         |  49000 |        1 |
+------+--------------+------------+--------+----------+
5 rows in set (0.00 sec)

			null operator
Null and not null:
-------------------
CREATE TABLE Projects (
   id INT,
   name VARCHAR(100),
   assignedto VARCHAR(100),
   start DATE,
   end DATE
);

INSERT INTO Projects VALUES
(1, 'Website Revamp', 'Alice', '2024-01-15', '2024-03-01'),
(2, 'Mobile App', 'Bob', '2024-02-01', NULL),
(3, 'Data Migration', NULL, NULL, NULL),
(4, 'SEO Optimization', 'Eve', '2024-03-10', '2024-04-20'),
(5, 'Cloud Migration', NULL, '2024-03-15', NULL);

--------------------------------------------------------------------------

Get all projects that are not assigned to anyone?
A:
mysql> select * from projects where assignedto is null;
+------+-----------------+------------+------------+------+
| id   | name            | assignedto | start      | end  |
+------+-----------------+------------+------------+------+
|    3 | Data Migration  | NULL       | NULL       | NULL |
|    5 | Cloud Migration | NULL       | 2024-03-15 | NULL |
+------+-----------------+------------+------------+------+
2 rows in set (0.00 sec)

2. Get all projects that have not started yet?
A:
mysql> select * from projects where start is null;
+------+----------------+------------+-------+------+
| id   | name           | assignedto | start | end  |
+------+----------------+------------+-------+------+
|    3 | Data Migration | NULL       | NULL  | NULL |
+------+----------------+------------+-------+------+
1 row in set (0.00 sec)

3. get all projects

A:
mysql> select * from projects where assignedto is not null;
+------+------------------+------------+------------+------------+
| id   | name             | assignedto | start      | end        |
+------+------------------+------------+------------+------------+
|    1 | Website Revamp   | Alice      | 2024-01-15 | 2024-03-01 |
|    2 | Mobile App       | Bob        | 2024-02-01 | NULL       |
|    4 | SEO Optimization | Eve        | 2024-03-10 | 2024-04-20 |
+------+------------------+------------+------------+------------+
3 rows in set (0.00 sec)
4.

A:
mysql> update employees set assignedto = 'prem' where assignedto is null;
ERROR 1054 (42S22): Unknown column 'assignedto' in 'where clause'
mysql> update projects set assignedto = 'prem' where assignedto is null;
Query OK, 2 rows affected (0.01 sec)
Rows matched: 2  Changed: 2  Warnings: 0

mysql> select * from projects;
+------+------------------+------------+------------+------------+
| id   | name             | assignedto | start      | end        |
+------+------------------+------------+------------+------------+
|    1 | Website Revamp   | Alice      | 2024-01-15 | 2024-03-01 |
|    2 | Mobile App       | Bob        | 2024-02-01 | NULL       |
|    3 | Data Migration   | prem       | NULL       | NULL       |
|    4 | SEO Optimization | Eve        | 2024-03-10 | 2024-04-20 |
|    5 | Cloud Migration  | prem       | 2024-03-15 | NULL       |
+------+------------------+------------+------------+------------+
5 rows in set (0.00 sec)

Update:
-------------

1.assign unassigned project to a default person(eg:prem)?
A:
mysql> update projects set assignedto = 'prem' where assignedto is null;
Query OK, 2 rows affected (0.01 sec)
Rows matched: 2  Changed: 2  Warnings: 0

mysql> select * from projects;
+------+------------------+------------+------------+------------+
| id   | name             | assignedto | start      | end        |
+------+------------------+------------+------------+------------+
|    1 | Website Revamp   | Alice      | 2024-01-15 | 2024-03-01 |
|    2 | Mobile App       | Bob        | 2024-02-01 | NULL       |
|    3 | Data Migration   | prem       | NULL       | NULL       |
|    4 | SEO Optimization | Eve        | 2024-03-10 | 2024-04-20 |
|    5 | Cloud Migration  | prem       | 2024-03-15 | NULL       |
+------+------------------+------------+------------+------------+
5 rows in set (0.00 sec)

2. Update start date to today for project that haven't started?

A:
mysql> update projects set start = curdate() where start is null;
Query OK, 1 row affected (0.01 sec)
Rows matched: 1  Changed: 1  Warnings: 0

mysql> select * from projects;
+------+------------------+------------+------------+------------+
| id   | name             | assignedto | start      | end        |
+------+------------------+------------+------------+------------+
|    1 | Website Revamp   | Alice      | 2024-01-15 | 2024-03-01 |
|    2 | Mobile App       | Bob        | 2024-02-01 | NULL       |
|    3 | Data Migration   | prem       | 2026-09-10 | NULL       |
|    4 | SEO Optimization | Eve        | 2024-03-10 | 2024-04-20 |
|    5 | Cloud Migration  | prem       | 2024-03-15 | NULL       |
+------+------------------+------------+------------+------------+
5 rows in set (0.00 sec)

3. Update the project name all completed projects to 'completed' instead of the exisiting name?

A: mysql> update projects set name = 'complete' where end is not null;
Query OK, 2 rows affected (0.04 sec)
Rows matched: 2  Changed: 2  Warnings: 0

mysql> select * from projects;
+------+-----------------+------------+------------+------------+
| id   | name            | assignedto | start      | end        |
+------+-----------------+------------+------------+------------+
|    1 | complete        | Alice      | 2024-01-15 | 2024-03-01 |
|    2 | Mobile App      | Bob        | 2024-02-01 | NULL       |
|    3 | Data Migration  | prem       | 2026-09-10 | NULL       |
|    4 | complete        | Eve        | 2024-03-10 | 2024-04-20 |
|    5 | Cloud Migration | prem       | 2024-03-15 | NULL       |
+------+-----------------+------------+------------+------------+
5 rows in set (0.00 sec)


Delete:
----------
Delete unassigned projects?
A:
mysql> delete from projects where assignedto is null;
Query OK, 0 rows affected (0.00 sec)

mysql> select * from projects;
+------+-----------------+------------+------------+------------+
| id   | name            | assignedto | start      | end        |
+------+-----------------+------------+------------+------------+
|    1 | complete        | Alice      | 2024-01-15 | 2024-03-01 |
|    2 | Mobile App      | Bob        | 2024-02-01 | NULL       |
|    3 | Data Migration  | prem       | 2026-09-10 | NULL       |
|    4 | complete        | Eve        | 2024-03-10 | 2024-04-20 |
|    5 | Cloud Migration | prem       | 2024-03-15 | NULL       |
+------+-----------------+------------+------------+------------+
5 rows in set (0.00 sec)

2. delete projects that haven't started yet?
A:
mysql> delete from projects where start is null;
Query OK, 0 rows affected (0.00 sec)

mysql> select * from projects;
+------+-----------------+------------+------------+------------+
| id   | name            | assignedto | start      | end        |
+------+-----------------+------------+------------+------------+
|    1 | complete        | Alice      | 2024-01-15 | 2024-03-01 |
|    2 | Mobile App      | Bob        | 2024-02-01 | NULL       |
|    3 | Data Migration  | prem       | 2026-09-10 | NULL       |
|    4 | complete        | Eve        | 2024-03-10 | 2024-04-20 |
|    5 | Cloud Migration | prem       | 2024-03-15 | NULL       |
+------+-----------------+------------+------------+------------+
5 rows in set (0.00 sec)

3. Delete projects that are already completed?
A:
mysql> delete from projects where end is not null;
Query OK, 2 rows affected (0.04 sec)

mysql> select * from projects;
+------+-----------------+------------+------------+------+
| id   | name            | assignedto | start      | end  |
+------+-----------------+------------+------------+------+
|    2 | Mobile App      | Bob        | 2024-02-01 | NULL |
|    3 | Data Migration  | prem       | 2026-09-10 | NULL |
|    5 | Cloud Migration | prem       | 2024-03-15 | NULL |
+------+-----------------+------------+------------+------+
3 rows in set (0.00 sec)


			Special operator
						---------------------------
Between-operator:
-------------------

mysql> CREATE TABLE Orders (
    ->  id INT,
    ->  customer_name VARCHAR(100),
    ->  order_date DATE,
    ->  total_amount DECIMAL(10,2)
    ->  );
Query OK, 0 rows affected (0.04 sec)

mysql>
mysql> -- STEP 2: Insert Records
mysql> INSERT INTO Orders VALUES
    ->  (1, 'Alice', '2024-03-01', 1500.00),
    ->  (2, 'Bob', '2024-03-05', 450.00),
    ->  (3, 'Charlie', '2024-03-10', 2500.00),
    ->  (4, 'Diana', '2024-03-15', 800.00),
    ->  (5, 'Eve', '2024-03-20', 1200.00),
    ->  (6, 'Frank', '2024-03-25', 3000.00),
    ->  (7, 'Grace', '2024-04-02', 1800.00),
    ->  (8, 'Henry', '2024-04-08', 950.00),
    ->  (9, 'Ivy', '2024-04-12', 2750.00),
    ->  (10, 'Jack', '2024-04-18', 650.00),
    ->  (11, 'Kevin', '2024-04-22', 4200.00),
    ->  (12, 'Lily', '2024-05-01', 1350.00),
    ->  (13, 'Michael', '2024-05-08', 5000.00),
    ->  (14, 'Nancy', '2024-05-15', 2250.00),
    ->  (15, 'Oliver', '2024-05-25', 900.00);
Query OK, 15 rows affected (0.01 sec)
Records: 15  Duplicates: 0  Warnings: 0



mysql> select * from orders;
+------+---------------+------------+--------------+
| id   | customer_name | order_date | total_amount |
+------+---------------+------------+--------------+
|    1 | Alice         | 2024-03-01 |      1500.00 |
|    2 | Bob           | 2024-03-05 |       450.00 |
|    3 | Charlie       | 2024-03-10 |      2500.00 |
|    4 | Diana         | 2024-03-15 |       800.00 |
|    5 | Eve           | 2024-03-20 |      1200.00 |
|    6 | Frank         | 2024-03-25 |      3000.00 |
|    7 | Grace         | 2024-04-02 |      1800.00 |
|    8 | Henry         | 2024-04-08 |       950.00 |
|    9 | Ivy           | 2024-04-12 |      2750.00 |
|   10 | Jack          | 2024-04-18 |       650.00 |
|   11 | Kevin         | 2024-04-22 |      4200.00 |
|   12 | Lily          | 2024-05-01 |      1350.00 |
|   13 | Michael       | 2024-05-08 |      5000.00 |
|   14 | Nancy         | 2024-05-15 |      2250.00 |
|   15 | Oliver        | 2024-05-25 |       900.00 |
+------+---------------+------------+--------------+
15 rows in set (0.00 sec)

mysql> select * from orders where order_date between '2024-03-03' and '2024-03-10';
+------+---------------+------------+--------------+
| id   | customer_name | order_date | total_amount |
+------+---------------+------------+--------------+
|    2 | Bob           | 2024-03-05 |       450.00 |
|    3 | Charlie       | 2024-03-10 |      2500.00 |
+------+---------------+------------+--------------+
2 rows in set (0.00 sec)

mysql> select * from orders where order_date between '2024-04-01' and '2024-04-30';
+------+---------------+------------+--------------+
| id   | customer_name | order_date | total_amount |
+------+---------------+------------+--------------+
|    7 | Grace         | 2024-04-02 |      1800.00 |
|    8 | Henry         | 2024-04-08 |       950.00 |
|    9 | Ivy           | 2024-04-12 |      2750.00 |
|   10 | Jack          | 2024-04-18 |       650.00 |
|   11 | Kevin         | 2024-04-22 |      4200.00 |
+------+---------------+------------+--------------+
5 rows in set (0.00 sec)

mysql> select * from orders where total_amount between 500 and 1500;
+------+---------------+------------+--------------+
| id   | customer_name | order_date | total_amount |
+------+---------------+------------+--------------+
|    1 | Alice         | 2024-03-01 |      1500.00 |
|    4 | Diana         | 2024-03-15 |       800.00 |
|    5 | Eve           | 2024-03-20 |      1200.00 |
|    8 | Henry         | 2024-04-08 |       950.00 |
|   10 | Jack          | 2024-04-18 |       650.00 |
|   12 | Lily          | 2024-05-01 |      1350.00 |
|   15 | Oliver        | 2024-05-25 |       900.00 |
+------+---------------+------------+--------------+
7 rows in set (0.00 sec)

mysql> update orders set total_amount = total_amount+1000 where order_date between '2024-03-04' and '2024-03-10';
Query OK, 2 rows affected (0.01 sec)
Rows matched: 2  Changed: 2  Warnings: 0

mysql> select * from orders;
+------+---------------+------------+--------------+
| id   | customer_name | order_date | total_amount |
+------+---------------+------------+--------------+
|    1 | Alice         | 2024-03-01 |      1500.00 |
|    2 | Bob           | 2024-03-05 |      1450.00 |
|    3 | Charlie       | 2024-03-10 |      3500.00 |
|    4 | Diana         | 2024-03-15 |       800.00 |
|    5 | Eve           | 2024-03-20 |      1200.00 |
|    6 | Frank         | 2024-03-25 |      3000.00 |
|    7 | Grace         | 2024-04-02 |      1800.00 |
|    8 | Henry         | 2024-04-08 |       950.00 |
|    9 | Ivy           | 2024-04-12 |      2750.00 |
|   10 | Jack          | 2024-04-18 |       650.00 |
|   11 | Kevin         | 2024-04-22 |      4200.00 |
|   12 | Lily          | 2024-05-01 |      1350.00 |
|   13 | Michael       | 2024-05-08 |      5000.00 |
|   14 | Nancy         | 2024-05-15 |      2250.00 |
|   15 | Oliver        | 2024-05-25 |       900.00 |
+------+---------------+------------+--------------+
15 rows in set (0.00 sec)

mysql> update orders set total_amount = total_amount-200 where total_amount between '1000' and '2000';
Query OK, 5 rows affected (0.01 sec)
Rows matched: 5  Changed: 5  Warnings: 0

mysql> select * from orders;
+------+---------------+------------+--------------+
| id   | customer_name | order_date | total_amount |
+------+---------------+------------+--------------+
|    1 | Alice         | 2024-03-01 |      1300.00 |
|    2 | Bob           | 2024-03-05 |      1250.00 |
|    3 | Charlie       | 2024-03-10 |      3500.00 |
|    4 | Diana         | 2024-03-15 |       800.00 |
|    5 | Eve           | 2024-03-20 |      1000.00 |
|    6 | Frank         | 2024-03-25 |      3000.00 |
|    7 | Grace         | 2024-04-02 |      1600.00 |
|    8 | Henry         | 2024-04-08 |       950.00 |
|    9 | Ivy           | 2024-04-12 |      2750.00 |
|   10 | Jack          | 2024-04-18 |       650.00 |
|   11 | Kevin         | 2024-04-22 |      4200.00 |
|   12 | Lily          | 2024-05-01 |      1150.00 |
|   13 | Michael       | 2024-05-08 |      5000.00 |
|   14 | Nancy         | 2024-05-15 |      2250.00 |
|   15 | Oliver        | 2024-05-25 |       900.00 |
+------+---------------+------------+--------------+
15 rows in set (0.00 sec)

mysql> update orders set total_amount = total_amount+(total_amount*0.10) where total_amount between '2500' and '5000';
Query OK, 5 rows affected (0.01 sec)
Rows matched: 5  Changed: 5  Warnings: 0

mysql> select * from orders;
+------+---------------+------------+--------------+
| id   | customer_name | order_date | total_amount |
+------+---------------+------------+--------------+
|    1 | Alice         | 2024-03-01 |      1300.00 |
|    2 | Bob           | 2024-03-05 |      1250.00 |
|    3 | Charlie       | 2024-03-10 |      3850.00 |
|    4 | Diana         | 2024-03-15 |       800.00 |
|    5 | Eve           | 2024-03-20 |      1000.00 |
|    6 | Frank         | 2024-03-25 |      3300.00 |
|    7 | Grace         | 2024-04-02 |      1600.00 |
|    8 | Henry         | 2024-04-08 |       950.00 |
|    9 | Ivy           | 2024-04-12 |      3025.00 |
|   10 | Jack          | 2024-04-18 |       650.00 |
|   11 | Kevin         | 2024-04-22 |      4620.00 |
|   12 | Lily          | 2024-05-01 |      1150.00 |
|   13 | Michael       | 2024-05-08 |      5500.00 |
|   14 | Nancy         | 2024-05-15 |      2250.00 |
|   15 | Oliver        | 2024-05-25 |       900.00 |
+------+---------------+------------+--------------+
15 rows in set (0.00 sec)

mysql> delete from orders where order_date between '2024-03-10' and '2024-03-20';
Query OK, 3 rows affected (0.01 sec)

mysql> select * from orders;
+------+---------------+------------+--------------+
| id   | customer_name | order_date | total_amount |
+------+---------------+------------+--------------+
|    1 | Alice         | 2024-03-01 |      1300.00 |
|    2 | Bob           | 2024-03-05 |      1250.00 |
|    6 | Frank         | 2024-03-25 |      3300.00 |
|    7 | Grace         | 2024-04-02 |      1600.00 |
|    8 | Henry         | 2024-04-08 |       950.00 |
|    9 | Ivy           | 2024-04-12 |      3025.00 |
|   10 | Jack          | 2024-04-18 |       650.00 |
|   11 | Kevin         | 2024-04-22 |      4620.00 |
|   12 | Lily          | 2024-05-01 |      1150.00 |
|   13 | Michael       | 2024-05-08 |      5500.00 |
|   14 | Nancy         | 2024-05-15 |      2250.00 |
|   15 | Oliver        | 2024-05-25 |       900.00 |
+------+---------------+------------+--------------+
12 rows in set (0.00 sec)

mysql> delete from orders where total_amount between '2500' and '5000';
Query OK, 3 rows affected (0.01 sec)

mysql> select * from orders;
+------+---------------+------------+--------------+
| id   | customer_name | order_date | total_amount |
+------+---------------+------------+--------------+
|    1 | Alice         | 2024-03-01 |      1300.00 |
|    2 | Bob           | 2024-03-05 |      1250.00 |
|    7 | Grace         | 2024-04-02 |      1600.00 |
|    8 | Henry         | 2024-04-08 |       950.00 |
|   10 | Jack          | 2024-04-18 |       650.00 |
|   12 | Lily          | 2024-05-01 |      1150.00 |
|   13 | Michael       | 2024-05-08 |      5500.00 |
|   14 | Nancy         | 2024-05-15 |      2250.00 |
|   15 | Oliver        | 2024-05-25 |       900.00 |
+------+---------------+------------+--------------+
9 rows in set (0.00 sec)


In operator
--------------
*This operator checks if a value exists within a specified list of values.

Emp table records using In operator:
------------------------------------
CREATE TABLE Emp (
 id INT,
 name VARCHAR(100),
 dept VARCHAR(20),
 salary INT
 );

-- STEP 2: Insert Records
INSERT INTO Emp VALUES
 (1, 'Alice', 'HR', 35000),
 (2, 'Bob', 'IT', 50000),
 (3, 'Charlie', 'Finance', 45000),
 (4, 'Diana', 'Marketing', 40000),
 (5, 'Eve', 'IT', 55000),
 (6, 'Frank', 'Finance', 48000),
 (7, 'Grace', 'Sales', 37000),
 (8, 'Henry', 'Admin', 42000),
 (9, 'Ivy', 'HR', 39000),
 (10, 'Jack', 'Sales', 46000),
 (11, 'Kevin', 'IT', 60000),
 (12, 'Lily', 'Marketing', 41000),
 (13, 'Michael', 'Admin', 38000),
 (14, 'Nancy', 'Finance', 52000),
 (15, 'Oliver', 'HR', 43000);


Get employees from IT and finance departments?

A:
mysql> select * from emp where dept in('finance', 'it');
+------+---------+---------+--------+
| id   | name    | dept    | salary |
+------+---------+---------+--------+
|    2 | Bob     | IT      |  50000 |
|    3 | Charlie | Finance |  45000 |
|    5 | Eve     | IT      |  55000 |
|    6 | Frank   | Finance |  48000 |
|   11 | Kevin   | IT      |  60000 |
|   14 | Nancy   | Finance |  52000 |
+------+---------+---------+--------+
6 rows in set (0.00 sec)

2. Increase salary by 2000 for employees in hr or marketing

A: mysql> SELECT*FROM EMP;
+------+---------+-----------+--------+
| id   | name    | dept      | salary |
+------+---------+-----------+--------+
|    1 | Alice   | HR        |  37000 |
|    2 | Bob     | IT        |  50000 |
|    3 | Charlie | Finance   |  45000 |
|    4 | Diana   | Marketing |  42000 |
|    5 | Eve     | IT        |  55000 |
|    6 | Frank   | Finance   |  48000 |
|    7 | Grace   | Sales     |  37000 |
|    8 | Henry   | Admin     |  42000 |
|    9 | Ivy     | HR        |  41000 |
|   10 | Jack    | Sales     |  46000 |
|   11 | Kevin   | IT        |  60000 |
|   12 | Lily    | Marketing |  43000 |
|   13 | Michael | Admin     |  38000 |
|   14 | Nancy   | Finance   |  52000 |
|   15 | Oliver  | HR        |  45000 |
+------+---------+-----------+--------+
15 rows in set (0.00 sec)

3. Remove employees from the finance or marketing department?

A:
mysql> delete from emp where dept in('finance','marketing');
Query OK, 5 rows affected (0.01 sec)

mysql> SELECT*FROM EMP;
+------+---------+-------+--------+
| id   | name    | dept  | salary |
+------+---------+-------+--------+
|    1 | Alice   | HR    |  37000 |
|    2 | Bob     | IT    |  50000 |
|    5 | Eve     | IT    |  55000 |
|    7 | Grace   | Sales |  37000 |
|    8 | Henry   | Admin |  42000 |
|    9 | Ivy     | HR    |  41000 |
|   10 | Jack    | Sales |  46000 |
|   11 | Kevin   | IT    |  60000 |
|   13 | Michael | Admin |  38000 |
|   15 | Oliver  | HR    |  45000 |
+------+---------+-------+--------

Case operator:
---------------

Employees Table and records using case operator

CREATE TABLE employees (
    emp_id INT PRIMARY KEY,
    emp_name VARCHAR(50),
    department VARCHAR(30),
    salary DECIMAL(10,2),
    experience INT,
    age INT
);

INSERT INTO employees VALUES
(101,'Ravi','IT',65000,5,28),
(102,'Priya','HR',45000,2,24),
(103,'Amit','Finance',75000,8,35),
(104,'Sneha','IT',55000,3,27),
(105,'Rahul','Sales',40000,1,22),
(106,'Kiran','Finance',90000,12,40),
(107,'Anjali','HR',52000,4,29),
(108,'Suresh','Sales',68000,7,33);

Query:
--------
mysql> select emp_name,
    -> experience,
    -> case
    -> when experience>=10 then 'expert'
    -> when experience>=5 then 'senior'
    -> when experience>=2 then 'junior'
    -> else 'fresher'
    -> end as 'experience-level'
    -> from employees;
+----------+------------+------------------+
| emp_name | experience | experience-level |
+----------+------------+------------------+
| Ravi     |          5 | senior           |
| Priya    |          2 | junior           |
| Amit     |          8 | senior           |
| Sneha    |          3 | junior           |
| Rahul    |          1 | fresher          |
| Kiran    |         12 | expert           |
| Anjali   |          4 | junior           |
| Suresh   |          7 | senior           |
+----------+------------+------------------+
8 rows in set (0.00 sec)


Like Operator:
---------------